<?xml version="1.0" encoding="UTF-8"?>
<candies xmlns:xsi="http://www.w3.org/2001/XMLSchema-instance"
          xmlns="http://www.example.com/candies"
          xsi:schemaLocation="http://www.example.com/candies candies.xsd">

    <candy brand="Toffifee" type="toffee">
        <name>Toffifee</name>
        <energy>500</energy>
        <date>2023-11-19</date>
        <production>August Storck</production>
        <ingredients>water sugar fructose vanilla</ingredients>

        <!--water sugar fructose vanilla-->

        <value>
            <protein>5</protein>
            <carbohydrates>60</carbohydrates>
            <fats>20</fats>
        </value>

    </candy>




</candies>
